{
  "id": "c0b5e759-0b8a-4b21-906a-82a14b59f180",
  "game": "Minecraft",
  "name": "itzg/docker-minecraft-server",
  "description": "Official Basalt Minecraft server template.",
  "version": "2026.7.15",
  "author": "Basalt Team",
  "logo": "https://raw.githubusercontent.com/basalt-host/templates/refs/heads/main/assets/minecraft.png",
  "settings": {
    "versions": [
      "LATEST",
      "1.21.3",
      "1.21.1",
      "1.20.4",
      "1.19.4"
    ],
    "fileBrowser": {
      "rootFolder": "/data",
      "readOnlyPaths": [],
      "hiddenPaths": []
    },
    "categories": [
      {
        "id": "general",
        "label": "General",
        "description": "",
        "children": [
          {
            "key": "TYPE",
            "defaultValue": "vanilla",
            "label": "Server Type",
            "description": "The type of Minecraft server to run.",
            "kind": "COMBOBOX",
            "required": false,
            "options": [
              {
                "value": "vanilla",
                "label": "Vanilla"
              },
              {
                "value": "bukkit",
                "label": "Bukkit"
              },
              {
                "value": "paper",
                "label": "Paper",
                "expand": {
                  "children": [
                    {
                      "key": "PAPER_CHANNEL",
                      "defaultValue": "stable",
                      "label": "Experimental Paper Version",
                      "description": "Paper provides experimental versions for the latest Minecraft version.",
                      "kind": "SELECT",
                      "options": [
                        {
                          "value": "DEFAULT",
                          "label": "Default"
                        },
                        {
                          "value": "EXPERIMENTAL",
                          "label": "Experimental"
                        },
                        {
                          "value": "ALPHA",
                          "label": "Alpha"
                        }
                      ],
                      "required": false
                    },
                    {
                      "key": "PAPER_BUILD",
                      "defaultValue": null,
                      "label": "Paper Build Version",
                      "description": "Leave empty for the latest build version for the selected Minecraft version.",
                      "kind": "TEXT",
                      "required": false
                    }
                  ]
                }
              },
              {
                "value": "fabric",
                "label": "Fabric",
                "expand": {
                  "children": [
                    {
                      "key": "FABRIC_LAUNCHER_VERSION",
                      "defaultValue": null,
                      "label": "Fabric Launcher Version",
                      "description": "Leave empty for the latest version for the selected Minecraft version.",
                      "kind": "TEXT",
                      "required": false
                    },
                    {
                      "key": "FABRIC_LOADER_VERSION",
                      "defaultValue": null,
                      "label": "Fabric Loader Version",
                      "description": "Leave empty for the latest version for the selected Minecraft version.",
                      "kind": "TEXT",
                      "required": false
                    }
                  ]
                }
              },
              {
                "value": "quilt",
                "label": "Quilt",
                "expand": {
                  "children": [
                    {
                      "key": "QUILT_INSTALLER_VERSION",
                      "defaultValue": null,
                      "label": "Quilt Installer Version",
                      "description": "Leave empty for the latest version for the selected Minecraft version.",
                      "kind": "TEXT",
                      "required": false
                    },
                    {
                      "key": "QUILT_LOADER_VERSION",
                      "defaultValue": null,
                      "label": "Quilt Loader Version",
                      "description": "Leave empty for the latest version for the selected Minecraft version.",
                      "kind": "TEXT",
                      "required": false
                    }
                  ]
                }
              },
              {
                "value": "forge",
                "label": "Forge",
                "expand": {
                  "children": [
                    {
                      "key": "FORGE_VERSION",
                      "defaultValue": null,
                      "label": "Forge Version",
                      "description": "Leave empty for the recommended version for the selected Minecraft version.",
                      "kind": "TEXT",
                      "required": false
                    }
                  ]
                }
              },
              {
                "value": "neoforge",
                "label": "NeoForge",
                "expand": {
                  "children": [
                    {
                      "key": "NEOFORGE_VERSION",
                      "defaultValue": null,
                      "label": "NeoForge Version",
                      "description": "Leave empty for the recommended version for the selected Minecraft version.",
                      "kind": "TEXT",
                      "required": false
                    }
                  ]
                }
              },
              {
                "value": "modrinth",
                "label": "Modrinth",
                "expand": {
                  "children": [
                    {
                      "key": "MODRINTH_MODPACK",
                      "defaultValue": null,
                      "label": "Modrinth Modpack",
                      "placeholder": "https://modrinth.com/modpack/cobblemon-fabric",
                      "description": "Specify either the Modrinth project URL, the project slug or the URL or path inside the container to an .mrpack file.",
                      "kind": "TEXT",
                      "required": true
                    },
                    {
                      "key": "MODRINTH_VERSION",
                      "defaultValue": null,
                      "label": "Modrinth Modpack Version",
                      "placeholder": "1.5.2",
                      "description": "You can optionally specify a specific modpack version number or ID.",
                      "kind": "TEXT",
                      "required": false
                    },
                    {
                      "enable": {
                        "isEmpty": "$MODRINTH_VERSION"
                      },
                      "key": "MODRINTH_DEFAULT_VERSION_TYPE",
                      "defaultValue": null,
                      "label": "Modrinth Modpack Version Type",
                      "description": "The latest release or beta version, respectively, of the Modrinth modpack is selected when the Minecraft Version is “LATEST” or “SNAPSHOT”. This can be overridden.",
                      "kind": "SELECT",
                      "required": false,
                      "options": [
                        {
                          "value": "release",
                          "label": "Stable"
                        },
                        {
                          "value": "beta",
                          "label": "Beta and Stable versions"
                        },
                        {
                          "value": "alpha",
                          "label": "Alpha, Beta and Stable versions"
                        }
                      ]
                    },
                    {
                      "enable": {
                        "isEmpty": "$MODRINTH_VERSION"
                      },
                      "key": "MODRINTH_LOADER",
                      "defaultValue": null,
                      "label": "Modrinth Modpack Loader",
                      "description": "If the modpack supports multiple loaders, you can specify the loader to use.",
                      "kind": "SELECT",
                      "required": false,
                      "options": [
                        {
                          "value": "fabric",
                          "label": "Fabric"
                        },
                        {
                          "value": "quilt",
                          "label": "Quilt"
                        },
                        {
                          "value": "forge",
                          "label": "Forge"
                        }
                      ]
                    }
                  ]
                }
              },
              {
                "value": "AUTO_CURSEFORGE",
                "label": "CurseForge (auto)",
                "expand": {
                  "children": [
                    {
                      "key": "CF_PAGE_URL",
                      "defaultValue": null,
                      "label": "CurseForge Modpack URL",
                      "placeholder": "https://www.curseforge.com/minecraft/modpacks/all-the-mods-8/files/4248390",
                      "description": "Specify the URL of the CurseForge project page. If you want to use a specific version, specify the URL to the corresponding file page of the project instead.",
                      "kind": "TEXT",
                      "required": true
                    },
                    {
                      "key": "CF_API_KEY",
                      "defaultValue": null,
                      "label": "CurseForge API Key",